"Welcome To Address Book Service MySQL and ER Diagram Program"



 #UC1 Ability to create a Address Book Service DB
mysql>
mysql>  create database AddressBookService;
Query OK, 1 row affected (0.14 sec)

mysql> show databases;
+--------------------+
| Database           |
+--------------------+
| addressbookservice |
| employeepayroll    |
| example            |
| information_schema |
| mysql              |
| payroll_services   |
| performance_schema |
| sakila             |
| sys                |
| world              |
+--------------------+
10 rows in set (0.06 sec)


 #UC2 Ability to create a Address Book Table with first and last names, address,city,state, zip, phone number and email as its attributes
mysql>
mysql> USE AddressBookService;
Database changed
mysql> create table addressbook
    -> (firstName varchar(50) NOT NULL, lastName varchar(50) NOT NULL,mobileNumber varchar(20) NOT NULL,email varchar(50) NOT NULL, city varchar(50) NOT NULL, state varchar(50) NOT NULL,
    -> zip long NOT NULL, PRIMARY KEY(firstName));
Query OK, 0 rows affected (0.59 sec)

mysql>  describe addressbook;
+--------------+-------------+------+-----+---------+-------+
| Field        | Type        | Null | Key | Default | Extra |
+--------------+-------------+------+-----+---------+-------+
| firstName    | varchar(50) | NO   | PRI | NULL    |       |
| lastName     | varchar(50) | NO   |     | NULL    |       |
| mobileNumber | varchar(20) | NO   |     | NULL    |       |
| email        | varchar(50) | NO   |     | NULL    |       |
| city         | varchar(50) | NO   |     | NULL    |       |
| state        | varchar(50) | NO   |     | NULL    |       |
| zip          | mediumtext  | NO   |     | NULL    |       |
+--------------+-------------+------+-----+---------+-------+
7 rows in set (0.00 sec)



mysql>  #UC3 Ability to insert new Contacts to Address Book
mysql>
mysql> INSERT INTO addressbook(firstName,lastName,mobileNumber,email,city,state,zip) VALUES
    ->  ('Bhuwan','arya','9389965338','bhu@gmail.com','haldwani','Uttarakhand',263126),
    -> ('Rohit','Bhandari','7757877309','Rohit@gmail.com','Rudrapur','Uttarakhand',241324),
    -> ('Piyus','rana','9370785156','piyus@gmail.com','kusumkhera','Uttarakhand',312412);
Query OK, 3 rows affected (0.12 sec)
Records: 3  Duplicates: 0  Warnings: 0

mysql> select * from addressbook;
+-----------+----------+--------------+-----------------+------------+-------------+--------+
| firstName | lastName | mobileNumber | email           | city       | state       | zip    |
+-----------+----------+--------------+-----------------+------------+-------------+--------+
| Bhuwan    | arya     | 9389965338   | bhu@gmail.com   | haldwani   | Uttarakhand | 263126 |
| Piyus     | rana     | 9370785156   | piyus@gmail.com | kusumkhera | Uttarakhand | 312412 |
| Rohit     | Bhandari | 7757877309   | Rohit@gmail.com | Rudrapur   | Uttarakhand | 241324 |
+-----------+----------+--------------+-----------------+------------+-------------+--------+
3 rows in set (0.00 sec)

mysql>  #UC4 Ability to edit existing contat person using their name
mysql>
mysql> UPDATE addressBook set MobileNumber= "9758747414" where FirstName='Bhuwan';
Query OK, 1 row affected (0.10 sec)
Rows matched: 1  Changed: 1  Warnings: 0

mysql> UPDATE addressBook set Zip= "315246" where FirstName='Bhuwan';
Query OK, 1 row affected (0.03 sec)
Rows matched: 1  Changed: 1  Warnings: 0

mysql> UPDATE addressBook set State= 'Banglore' where FirstName='Bhuwan';
Query OK, 1 row affected (0.06 sec)
Rows matched: 1  Changed: 1  Warnings: 0

mysql>  UPDATE addressBook set City= 'Davanagere' where FirstName='Bhuwan';
Query OK, 1 row affected (0.08 sec)
Rows matched: 1  Changed: 1  Warnings: 0

mysql> select * from addressBook;
+-----------+----------+--------------+-----------------+------------+-------------+--------+
| firstName | lastName | mobileNumber | email           | city       | state       | zip    |
+-----------+----------+--------------+-----------------+------------+-------------+--------+
| Bhuwan    | arya     | 9758747414   | bhu@gmail.com   | Davanagere | Banglore    | 315246 |
| Piyus     | rana     | 9370785156   | piyus@gmail.com | kusumkhera | Uttarakhand | 312412 |
| Rohit     | Bhandari | 7757877309   | Rohit@gmail.com | Rudrapur   | Uttarakhand | 241324 |
+-----------+----------+--------------+-----------------+------------+-------------+--------+
3 rows in set (0.00 sec)